{
  "$generated": true,
  "$source": "pipeline-derived",
  "$schema": "./languages.schema.json",
  "$note": "TIER 2 codegen-ready spec — produced by the geo data pipeline from contracts/geo/src-data/*.spec.json (Tier 1). Matches the canonical entity record shape; consumed directly by codegen (.NET SourceGen + TS emitter — Tier 3) to produce concrete entity types. Do NOT hand-edit — re-run `pnpm geo:refresh` to regenerate. IsSupported derived from contracts/messages/*.json file presence — languages of selectable locales.",
  "catalogVersion": "0.1.0",
  "generatedAt": "2026-10-21T06:05:33.378Z",
  "entries": [
    {
      "iso6391Code": "aa",
      "name": "Afar",
      "endonym": "Qafár af",
      "writingDirection": "LTR",
      "isSupported": false,
      "spokenInCountryISO31661Alpha2Codes": ["DJ", "ER", "ET"]
    },
    {
      "iso6391Code": "ab",
      "name": "Abkhazian",
      "endonym": "Аԥсуа бызшәа",
      "writingDirection": "LTR",
      "isSupported": false,
      "spokenInCountryISO31661Alpha2Codes": ["GE", "TR"]
    },
    {
      "iso6391Code": "ae",
      "name": "Avestan",
      "endonym": null,
      "writingDirection": "RTL",
      "isSupported": false,
      "spokenInCountryISO31661Alpha2Codes": []
    },
    {
      "iso6391Code": "af",
      "name": "Afrikaans",
      "endonym": "Afrikaans",
      "writingDirection": "LTR",
      "isSupported": false,
      "spokenInCountryISO31661Alpha2Codes": ["BW", "NA", "ZA"]
    },
    {
      "iso6391Code": "ak",
      "name": "Akan",
      "endonym": null,
      "writingDirection": "LTR",
      "isSupported": false,
      "spokenInCountryISO31661Alpha2Codes": ["GH"]
    },
    {
      "iso6391Code": "am",
      "name": "Amharic",
      "endonym": "አማርኛ",
      "writingDirection": "LTR",
      "isSupported": false,
      "spokenInCountryISO31661Alpha2Codes": ["ET", "IL"]
    },
    {
      "iso6391Code": "an",
      "name": "Aragonese",
      "endonym": "idioma aragonés",
      "writingDirection": "LTR",
      "isSupported": false,
      "spokenInCountryISO31661Alpha2Codes": ["ES"]
    },
    {
      "iso6391Code": "ar",
      "name": "Arabic",
      "endonym": "العربية",
      "writingDirection": "RTL",
      "isSupported": false,
      "spokenInCountryISO31661Alpha2Codes": [
        "AE",
        "BH",
        "CA",
        "CM",
        "CY",
        "DJ",
        "DZ",
        "EG",
        "EH",
        "ER",
        "GB",
        "IL",
        "IQ",
        "IR",
        "JO",
        "KE",
        "KM",
        "KW",
        "LB",
        "LY",
        "MA",
        "ML",
        "MR",
        "NE",
        "NG",
        "OM",
        "PS",
        "QA",
        "SA",
        "SD",
        "SO",
        "SS",
        "SY",
        "TD",
        "TJ",
        "TN",
        "TR",
        "YE"
      ]
    },
    {
      "iso6391Code": "as",
      "name": "Assamese",
      "endonym": "অসমীয়া ভাষা",
      "writingDirection": "LTR",
      "isSupported": false,
      "spokenInCountryISO31661Alpha2Codes": ["IN"]
    },
    {
      "iso6391Code": "av",
      "name": "Avaric",
      "endonym": "авар мацӀ",
      "writingDirection": "LTR",
      "isSupported": false,
      "spokenInCountryISO31661Alpha2Codes": ["RU"]
    },
    {
      "iso6391Code": "ay",
      "name": "Aymara",
      "endonym": "Aymar aru",
      "writingDirection": "LTR",
      "isSupported": false,
      "spokenInCountryISO31661Alpha2Codes": ["BO", "PE"]
    },
    {
      "iso6391Code": "az",
      "name": "Azerbaijani",
      "endonym": "Azərbaycan dili",
      "writingDirection": "LTR",
      "isSupported": false,
      "spokenInCountryISO31661Alpha2Codes": ["AM", "AZ", "TR"]
    },
    {
      "iso6391Code": "ba",
      "name": "Bashkir",
      "endonym": "башҡорт теле",
      "writingDirection": "LTR",
      "isSupported": false,
      "spokenInCountryISO31661Alpha2Codes": ["RU"]
    },
    {
      "iso6391Code": "be",
      "name": "Belarusian",
      "endonym": "беларуская мова",
      "writingDirection": "LTR",
      "isSupported": false,
      "spokenInCountryISO31661Alpha2Codes": ["BY", "PL", "UA"]
    },
    {
      "iso6391Code": "bg",
      "name": "Bulgarian",
      "endonym": "български език",
      "writingDirection": "LTR",
      "isSupported": false,
      "spokenInCountryISO31661Alpha2Codes": ["BG", "GR", "MD", "RO", "TR", "UA"]
    },
    {
      "iso6391Code": "bi",
      "name": "Bislama",
      "endonym": "Bislama",
      "writingDirection": "LTR",
      "isSupported": false,
      "spokenInCountryISO31661Alpha2Codes": ["VU"]
    },
    {
      "iso6391Code": "bm",
      "name": "Bambara",
      "endonym": "Bamanankan",
      "writingDirection": "LTR",
      "isSupported": false,
      "spokenInCountryISO31661Alpha2Codes": ["ML"]
    },
    {
      "iso6391Code": "bn",
      "name": "Bengali",
      "endonym": "বাংলা",
      "writingDirection": "LTR",
      "isSupported": false,
      "spokenInCountryISO31661Alpha2Codes": ["BD", "CA", "GB", "IN", "NP"]
    },
    {
      "iso6391Code": "bo",
      "name": "Tibetan",
      "endonym": "བོད་སྐད།",
      "writingDirection": "LTR",
      "isSupported": false,
      "spokenInCountryISO31661Alpha2Codes": ["CN", "IN", "NP"]
    },
    {
      "iso6391Code": "br",
      "name": "Breton",
      "endonym": "brezhoneg",
      "writingDirection": "LTR",
      "isSupported": false,
      "spokenInCountryISO31661Alpha2Codes": ["FR"]
    },
    {
      "iso6391Code": "bs",
      "name": "Bosnian",
      "endonym": "bosanski jezik",
      "writingDirection": "LTR",
      "isSupported": false,
      "spokenInCountryISO31661Alpha2Codes": ["BA", "XK"]
    },
    {
      "iso6391Code": "ca",
      "name": "Catalan; Valencian",
      "endonym": "català",
      "writingDirection": "LTR",
      "isSupported": false,
      "spokenInCountryISO31661Alpha2Codes": ["AD", "ES", "FR", "IT"]
    },
    {
      "iso6391Code": "ce",
      "name": "Chechen",
      "endonym": "нохчийн мотт",
      "writingDirection": "LTR",
      "isSupported": false,
      "spokenInCountryISO31661Alpha2Codes": ["RU"]
    },
    {
      "iso6391Code": "ch",
      "name": "Chamorro",
      "endonym": "Fino' Chamoru",
      "writingDirection": "LTR",
      "isSupported": false,
      "spokenInCountryISO31661Alpha2Codes": ["GU", "MP"]
    },
    {
      "iso6391Code": "co",
      "name": "Corsican",
      "endonym": "corsu",
      "writingDirection": "LTR",
      "isSupported": false,
      "spokenInCountryISO31661Alpha2Codes": ["FR"]
    },
    {
      "iso6391Code": "cr",
      "name": "Cree",
      "endonym": "ᐃᔨᔫ ᐊᔨᒧᐎᓐ",
      "writingDirection": "LTR",
      "isSupported": false,
      "spokenInCountryISO31661Alpha2Codes": ["CA"]
    },
    {
      "iso6391Code": "cs",
      "name": "Czech",
      "endonym": "čeština",
      "writingDirection": "LTR",
      "isSupported": false,
      "spokenInCountryISO31661Alpha2Codes": ["CZ", "SK"]
    },
    {
      "iso6391Code": "cu",
      "name": "Church Slavic; Old Slavonic; Church Slavonic; Old Bulgarian; Old Church Slavonic",
      "endonym": "словѣньскъ ѩꙁꙑкъ",
      "writingDirection": "LTR",
      "isSupported": false,
      "spokenInCountryISO31661Alpha2Codes": ["RU"]
    },
    {
      "iso6391Code": "cv",
      "name": "Chuvash",
      "endonym": "чăваш чĕлхи",
      "writingDirection": "LTR",
      "isSupported": false,
      "spokenInCountryISO31661Alpha2Codes": ["RU"]
    },
    {
      "iso6391Code": "cy",
      "name": "Welsh",
      "endonym": "Cymraeg",
      "writingDirection": "LTR",
      "isSupported": false,
      "spokenInCountryISO31661Alpha2Codes": ["AR", "GB"]
    },
    {
      "iso6391Code": "da",
      "name": "Danish",
      "endonym": "dansk",
      "writingDirection": "LTR",
      "isSupported": false,
      "spokenInCountryISO31661Alpha2Codes": ["DE", "DK", "GL", "IS"]
    },
    {
      "iso6391Code": "de",
      "name": "German",
      "endonym": "Deutsch",
      "writingDirection": "LTR",
      "isSupported": true,
      "spokenInCountryISO31661Alpha2Codes": [
        "AT",
        "BE",
        "BG",
        "BR",
        "CA",
        "CH",
        "CZ",
        "DE",
        "DK",
        "FI",
        "FR",
        "GB",
        "GR",
        "HU",
        "IT",
        "KZ",
        "LI",
        "LT",
        "LU",
        "NA",
        "NL",
        "PL",
        "PY",
        "RO",
        "SI",
        "SK",
        "US"
      ]
    },
    {
      "iso6391Code": "dv",
      "name": "Divehi; Dhivehi; Maldivian",
      "endonym": "ދިވެހި",
      "writingDirection": "RTL",
      "isSupported": false,
      "spokenInCountryISO31661Alpha2Codes": ["IN", "MV"]
    },
    {
      "iso6391Code": "dz",
      "name": "Dzongkha",
      "endonym": "རྫོང་ཁ་",
      "writingDirection": "LTR",
      "isSupported": false,
      "spokenInCountryISO31661Alpha2Codes": ["BT", "IN"]
    },
    {
      "iso6391Code": "ee",
      "name": "Ewe",
      "endonym": "Eʋegbe",
      "writingDirection": "LTR",
      "isSupported": false,
      "spokenInCountryISO31661Alpha2Codes": ["GH", "TG"]
    },
    {
      "iso6391Code": "el",
      "name": "Modern Greek (1453-)",
      "endonym": "νέα ελληνικά",
      "writingDirection": "LTR",
      "isSupported": false,
      "spokenInCountryISO31661Alpha2Codes": [
        "AL",
        "CA",
        "CY",
        "DE",
        "EG",
        "GR",
        "IT",
        "RO",
        "TR",
        "UA"
      ]
    },
    {
      "iso6391Code": "en",
      "name": "English",
      "endonym": "English",
      "writingDirection": "LTR",
      "isSupported": true,
      "spokenInCountryISO31661Alpha2Codes": [
        "AE",
        "AG",
        "AI",
        "AR",
        "AS",
        "AT",
        "AU",
        "AW",
        "BA",
        "BB",
        "BD",
        "BE",
        "BG",
        "BI",
        "BM",
        "BN",
        "BR",
        "BS",
        "BT",
        "BW",
        "BZ",
        "CA",
        "CC",
        "CH",
        "CK",